<?xml version="1.0" encoding="UTF-8" standalone="no"?>
<engine name="KryoEngine" 
    xmlns:xs="http://www.w3.org/2001/XMLSchema"
	xmlns:xi="http://www.w3.org/2001/XInclude"
	xmlns:xsi="http://www.w3.org/2001/XMLSchema-instance"
	xsi:noNamespaceSchemaLocation="file:///D:\development\repo\cs-studio\applications\plugins\org.csstudio.archive.common.engine\lib\archiveEngineCfg.xsd">
	<!-- ... -->
	<system>
		<xi:include href="amtfChannels.xml" />
		<xi:include href="cmtbChannels.xml" />
		<xi:include href="xfelChannels.xml" />
	</system>
	<httpViewer url="http://krynfs.desy.de:4811/index.html">
		<groups>
			<group name="CMTB.prod">
				<channelRef controlSystem="EPICS_V3"
             name="kryo:1stChannel_ai" />
				<channelRef controlSystem="EPICS_V3"
             name="kryo:2ndChannel_mbbi" />
				<!-- ... -->
			</group>
			<group name="CMTB.cfg">
				<channelRef controlSystem="EPICS_V3"
             name="kryo:2ndChannel_mbbi" />
				<!-- ... -->
			</group>
			<group name="XFEL.all">
				<channelRef controlSystem="DOOCS"
             name="xfel:1stChannel_ao" />
				<!-- ... -->
			</group>
			<group name="XFEL.specific">
				<channelRef controlSystem="DOOCS"
             name="xfel:1stChannel_ao" />
			</group>

			<group name="Kaltfahren">
				<channelRef controlSystem="EPICS_V3"
                            name="tralalaChannel_ai" />
			</group>

			<!-- ... -->
		</groups>
	</httpViewer>
</engine>
